Code_Site;Nom des Sites;Gestionnaire/Facilitation des sites;Nom;Contact ;Nombre de Population avant la crise du 26 Septembre 2015;Date de visite des sites;Nombres des PDIs ajouté aprèss la crise;Total des PDIs;Tendency;Sécurité;Acteurs/Protection;Infos Protection;Besoin Protection;Reponse du Cluster;Acteurs/Child Protection;Infos Child Protection;Besoin Child Protection;Reponse du Cluster;Acteurs/GBV;Infos VBG;Besoin VBG;Reponse du Cluster;Acteurs/WASH;Infos WASH;Besoin WASH;Reponse du Cluster;Acteurs/Education;Infos Education;Besoin Education;Reponse du Cluster;Acteurs/Health;Info Health;Besoin Health;Reponse du Cluster;Acteurs/Food Security;Info Food Security;Besoin Food Security;Reponse du Cluster;Acteurs/Nutrition;Info Nutrition;Besoin Nutrition;Reponse du Cluster;Acteurs/Abris/NFIs;Info Abris/NFIs;Besoin Abris/NFIs;Reponse Cluster;AGR;Commentaires;En evidence;profil url
BGI_S001;Aéroport;PU-AMI;Amélie d'HAUTEFEUILLE;72 10 56 70;11000;02.12.;9938;20938;Stable;tbc;Craed, Triangle, Recope;tbc;VBG, Education;;Craed, Triangle, Recope;;EDUCATION: Besoin d'un acteur pour ETAPE;;Aucun;Aucun acteur sur site pour le support psycho-social et la prévention/ sensibilisation;Besoin d'acteur sur le site;;ACTED, CICR;tbc;tbc;Collecte de dechets + Assanissement, Accès à l'eau;Pas d'acteur;Selon dernière enquête RECOPE (finalisée le 8/10/2015) 5280 enfants non scolarisé sur le site;Besoin d'un acteur pour permettre aux enfants déplacés d'avoir accès à l'éducation en période de rentrée scolaire;;MSF Belgique;;;Activités d'observation, stabilisation et de références en cours, OPD tous les âges, PEV Vaccination rougeole 6 mois - 10 ans ;tbc;;;;tbc;;;;Aucun acteur;;Bâches et NFIs pour l'ensemble des PDIs du site;;Besoin en AGR, Les IDPs ont perdu leurs sources de revenus dans les quartiers;Z1: 786Z2: 1705Z3: 9388Z4: 1108Z5: 1088Z6: 545Z7: 1346Z8: 777Z9: 3055Z10: 385Z11: 754;oui;/data/profils/BGI_S001.pdf
BGI_S002;Communaute des Apôtres de Jesus Crucifié / Centre de Sante Padre Pio ;OIM(Facilitation du site);Lévy (Locale);72652232;488;16.12.;1095;1583;Stable;Besoin de la présence de la MINUSCA autour du  site;Pas d'acteur;;;;Pas d'acteur;;;;IRC;;;;OXFAM  + ACTED;;Besoin de vidanger les latrines.;Eau, Assanissement et gestion de dechets;Pas d'acteur;;;;Pas d'acteur;Présence d'un centre de santé privé.;Besoin d'une équipe mobile de santé;;CICR;Ambassade de France a fait le don de 19 sac de riz.;Besoin en vivre;;Pas d'acteur;ACTED continue la construction des Abris.;;;ACTED abris et FICR pour NFIs;ACTED est entrain de refectionner des abris communautaires;Besoin de NFI;ACTED: 1 AC en costruction + 4 planifiés. FICR Distribution NFI ;;;;/data/profils/BGI_S002.pdf
BGI_S009;Don Bosco / Damala ;DRC;Placide ;72506255;954;17.12.15;43;714;Diminution;Situation des PDI de plus en plus dégradante .                                                                                                              ;DRC ;un homme à été poignardé sur le site suite à un adultère;Rencontre et écoute des PDI. ;;tbc;;;;DRC;;;;Oxfam et ACTED; 85 Latrines dont 17 non  utilisées et 36 Douches. Vandalisation des bâches des deux blocs latrines réhabilité par NRC.  ; ;;;Besion d'une structure éducative pour l'année 2015-2016 aux enfants du site;;;;Plusieurs cas des enfants  et adultes surtout 3ème âge  avec l'état de santé altéré .;Besoin d'une équipe mobile de santé;;;Dernières dates distribution décembre 2014;Besoins de vivres.;;tbc;;;;;23 Tentes et 1 centre collectif.  Les 23  tentes sont  toutes vestuces et suintent énormemnt.;Besoin de réhabilité des tentes du sites. Besoin NFI;;;;;/data/profils/BGI_S009.pdf
BGI_S011;Eglise Evangélique des Frères des Castors;DRC;Placide ;72506255;1370;17.12.15;;602;Mouvements aleatoires de la population par rapport à la sécurité(population statique);Site très affecté par la dernière crise/zone de conflits. Besoin d'écoute. Insécurité la nuit;DRC;;;;;Un cas de torture d'un garçon sur le site par G.A.U;Rencontre et écoute des PDI. ;;DRC ;CRCA a fait une sensibilisation sur la violence basée sur le genre;;;Oxfam et ACTED; 16 latrines et 12 douches.                                   Puisards et latines trop pleins. Appui en water trucking suite pb sur canalisation SODECA mais insuffisant.;Besoin de ravitaillement en Eau;;;pas d'Etape sur le site;besoin d'un acteur en education;;;;;;;CRCA (Croix rouge centrafricaine a prévue une distribution le mardi 15.12.15 sur la thématique de la violence basé sur le genre).;;;;;;;;28 tentes  1 bâtiment collectif. ;Tentes vestuces à réhabilitées.;;;;;/data/profils/BGI_S011.pdf
BGI_S015;Eglise Notre Dame de Fatima;OIM(Facilitation du site);Père Giovanni (Locale);72155174;150;18.12.;700;850;Stable;Besoin de renforcer les patrouilles de la Minusca dans le secteur;Pas d'acteur;;;;Pas d'acteur;;Besoin d'un acteur;;IRC a repris des activités de prévention de VBG sur le site;Organisation des sketch sur la VBG par la CICR aujourd'hui 18.12.;;;OXFAM  + ACTED;Reception des produits d'hygiène livré par OXFAM;;Assanisement, Gestion de dechets;Pas d'acteur;;;;CICR;La croix rouge Francaise assiste les PDIs par des consultations et les Médicaments aux malades.;;;BSF;;Besoin des vivres;;Pas d'acteur;;;;BSF;;Pour le moment un besoin  est urgent de construire des abris communautaire pour les PDI du site;171 kit NFI light;;;;/data/profils/BGI_S015.pdf
BGI_S017;Faculte de Theologie (FATEB);OIM(Facilitation du site);BELLA Francis (Locale);72034772;124;16.12.;2500;2624;Stable ;;ACF;;Besoin d'un acteur;;Aucun acteur;;Besoin d'un espace ami d'enfant.;;Pas d'acteur;;Besoin d'un acteur;;ACTED et ACF;Reception des produits de désinfection  de la part de ACTED le 14/12/2015. Le site est envahi des ordures. Trois latrines pour enfant par ACTED. Fuite de conduit de la SODECA empechant 4 robinets de fonctionner.ACF est entrain de realiser des cannaux de drainnage sur le site.;Besoin de construction d'un bac à ordure. Besoin d'évacuation des ordures.;Construction/maintenance/entretient latrines et douches, vidange latrines, collecte primaire et secondaire de dechets, accès à l'eau, activités d'hygiéne, drainage;Pas d'acteur;;Besoin d'inscrire les enfants du site à l'école.;;MSF Belgique, ACF;Consultation ce jour de l'equipe mobile de sante MSF Belgique;;Santé primaire, dépistage et référence malnutrition, références médicales en cas d'urgence. CM tous âges Mardi et Vendredi. Vaccination rougeole 6 mois - 10 ans ;World-Vision;Distribution des vivres le 10/12/2015;;;Pas d'acteur;;;;Yamacuir: ;la pluie a innondée les 22 abris et troué .   23 abris sont sur le site;;15 AC construits + 8 rehabilités et 466 kit NFI light;;Poursuite de l'enregistrement des PDIs par HCR ce jour 11/12/2015;oui;/data/profils/BGI_S017.pdf
BGI_S020;Grand séminaire St Marc de Bimbo ;DRC;Placide ;72506255;1853;17.12.15;2247;4100;nouvx arrivés du 29/10 de Fatima(3ème et 6ème arr) Kina, Cattin, Kokoro(3ème) mvt et enregistrement encore encours.;;IRC, AFJC  et ACTED;;;;IRC;Redémarrage des activités le 12.11.15;;;;;;;Oxfam et ACTED;64 Latrines et 41 douches. Fuite des robinets et  non réparation roulement forage. ; Cuirage des puisards dans secteur C, Evacuation de l’ordure entassée dans le site pour garantir standard humanitaire sur le site;;;Les écoliers de ETAPE/ JRS orientés dans des écoles publiques des environs pour cette année ont des problèmes à se faire admettre  dans ces écoles. Fautes de moyens d'inscription.;Prise en charge des écoliers de ETAPE;;Alima ;Besoin augmentation nombre de jours consultation.;Besoin assistance.;;;PDI renvoient camion vivres CICR vendredi 27 nov. au motif que vivres pas assez suffisant;;;tbc;;;;;36 tentes et 5 centres collectifs. La réhabilitation suspensdu temporairement par Acted problème de bois .;33 tentes en courréhabilitation .;;;;;/data/profils/BGI_S020.pdf
BGI_S029;Mission Carmel;DRC;Placide ;72506255;2255;17.12.15;4515;6770;nouvx arrivés de Fatima(3ème et 6ème arr) Kina, Cattin, Kokoro(3ème) qlq PDI de mukassa depuis 29/10 . Mvt des pop  continu et enregistrement encours. ;;IRC, ACF et DRC;Cas de violences physiques et conjugales régulières entre les PDI.                                                             ;;;;;;;IRC;;;;; 136 Latrines et 56 douches mal entretenus et nauséabonds. Motif evacuation des infrastures sanitaire et des points d'eau.Réhabilitation des dalettes des latrines et douches sur le Site par OXFAM Dépôt d'ordures pleins;Besoin d'eau;;;;;;Alima ;Recrudescence du paludisme. ;Besoin Moustiquaire;;;;;;tbc;;;;;90 tentes . ACTED finit la construction 2 Abris;2 abris construis. ;;;;;/data/profils/BGI_S029.pdf
BGI_S034;Mission St Charles Lwanga;DRC;Placide ;72506255;76;17.12.15;0;76;stable;;DRC;une PDI qui était sortie du site, elle été accusé de mort d'un enfant dans son quartier, elle est retournée sur le site ce qui fait peur aux déplacés                    ;demande d'une ecoute. ;;tbc;;;;DRC;;;;ACTED; 15 Latrines dont 4 pour enfants et 9 douches.; Besoins d'évacuation des ordures et vidange des latrines;;tbc;;;;;Un Tuberculeux âgé de 45ans  sous traitement, cachectique ;Besoin d'une assistance alimentaire pour ce tuberculeux.;;tbc;;;;tbc;;;;tbc;Dementèlement d'une tente avec demande de démentèlement de 2 autres sur  les 6 restant. ;;;;;;/data/profils/BGI_S034.pdf
BGI_S034;Paroisse St Trinité des castors;OIM(Facilitation du site);Abbe Bonaventure;75393136;0;04.12.;0;0;Vidé;;;;;;;;;;;;;;;;;;;;;;;;;;;;;;;;;;;;;;;Les PDIs qui se sont déplacés à cause de la recente crise du 26 Sept 2015 mais actuellement ils manifestent le desir de regagner le site. ;;/data/profils/BGI_S034.pdf
BGI_S038;Saint Antoine de Padoue;OIM(Facilitation du site);Bertille (Locale);75125846;144;18.12.;255;399;Stable 8HCR a procédé à un enregistrement des PDI de ce site);Satisfaction;Pas d'acteur;;Besoin d'un acteur;;Aucun acteur;;Besoin pour acteur de protection de l'enfance.;;;;;;OXFAM ;Un seul forage pour tous les PDIs;Satisfaction en eau. Surveillance à faire pour les latrines et douches.;Eau, Assanissement et gestion de dechets;Pas d'acteur;;;;Pas d'acteur;;Besoin de visite médicale sur le cite.;;Pas d'acteur ;;Besoin en vivres. ;;ACF;;Besoin d'acteur pour surveillance nutritionnelle ches les enfants de moins de 5 ans. ;;ACTED et FICR pour les NFIs;;Besoin des NFI;Distribution NFI;;;;/data/profils/BGI_S038.pdf
BGI_S041;St Joseph de Mukassa ;DRC;Placide ;72506255;1818;17.12.15;;1000;  Nouveaux arrivés de Kina, Cattin, Kokoro(3ème) du 29/10 puis mvt panique fuite des PDI vers mont carmel et famille d'acceuilles Bimbo . Retours depuis quelques jours de certains PDI qui avaient fuit entre temps; Calme précaire aux alentours du site;IRC, AFJC, ACF et DRC.;cas de décès d'une femme suite à une longue maladie;Besoin assistance alimentaire;;tbc;;;;IRC;;;;Oxfam et ACTED; 46 Latrines et 48 douches. Installation d’un château d’eau sur le site par ANEA. Dépôts ordures pleins;Besoins puisards dans le secteur 8 et 10 refection de puisard du secteur 11. Besoin urgent d'évacuation des ordures. ;;ECAC;pas d'ecole sur le site;Besoin de prise en charge scolarité enfants PDI par Unicef encore pour cette année ;;;Un  malade(chronique)en manque de moyens pour aller retirer ses médocs au CS voit  son état  se dégradé de plus en plus. ;;;;;;;tbc;;;;;77 Abris communautaires. ;Besoin de rehabilitation des 77 tentes;;;;;/data/profils/BGI_S041.pdf
BGI_S044;St. Jacques de Kpetene;DRC;Placide ;72506255;278;17.12.15;118;396;Stable;;DRC (mobile);;;;tbc;;;;tbc;;;;Oxfam et ACTED;20 latrines (10 hommes/10femmes), 6 douches, 6 point d'eau. Puisards pleins/neccessite curage d'urgence:;Besoin de vidange. Vidange des latrines sur le site. Curage des puisards pleins.  Vidange des latrines sur le site. Curage des puisards pleins. .;;tbc;;;;tbc;;;;;;;;tbc;;;;;5 abris communautaires. Inssuffisants pour les PDI;Besoin de construire des abris pour les PDI. Besoin NFI;;;;;/data/profils/BGI_S044.pdf
BGI_S053;Quartier Votongbo2;OIM(Facilitation du site);CHANGE Christian (Locale);72600997/75551409;158;18.12.;0;158;Stable;;Pas d'acteur;;Besoin d'un acteur;;Pas d'acteur;;Besoin d'un acteur;;Pas d'acteur;;;;OXFAM  + ACTED;OXFAM a amené de l'eau dans Blader. ACTED continu de payer les hygiénistes. ACTED a fourni des kits d'entretien des latrines pour trois mois (du 3 décembre15 au 3 janvier 16). l'eau de forage ne fonctionne plus.7 douches n'ont plus de fermeture;Besoin de riviser la pompe. Besoin de baches pour fermer les entrées de 7 douches.;Assanisement, Gestion de dechets;Pas d'acteur;;Besoin d'un acteur;;Pas d'acteur;problème de santé des  plusieurs PDIs qui sont des personnes de 3ème âges venues des provinces.;Besoin d'une équipe mobile de santé;;VITALITE PLUS;Distribution des vivres le 13 Octobre 2015 ;Besoin en vivre;;Pas d'acteur;;;;pas d'acteur;Abris déchiré par des A-B;Besoin de réhabilité des abris déchirés sur le site;;;UNHCR a appelé le responsable du site lui demandant d'informer les PDIs qu'il y aura un enregistrement ;Visite de Pape aux PDIs de ce site;/data/profils/BGI_S053.pdf
BGI_S059;Mosquée Centrale;OIM ;SABAKERE John;72744655/75227817;1583;18.12.;604;2187;Stable;;Pas d'acteur;;Besoin d'une patrouille permanente de la force convensionnelle dans ces quartiers;;Pas d'acteur.;;Besoin d'un acteur en ETAPE;;Pas d'acteur;;;;ANEA + ACTED;Plus de 3 mois et demi les hygienistes n'ont pas perçu leur salaire. 2 robinets sont endomagés sur le site. Besoin de maçonnerie pour les canaux de drainage. ;Besoin de paiement de ces hygienistes. Et besoin de réparation de 2 robinets d'eau potable endomagés. Besoin de la maçonnerie de ses canaux.;;Pas d'acteur;Plusieurs enfants en âge scolaire de ce site n'ont accès à l'éducation.;Besion d'une structure éducative pour l'année 2015-2016 aux enfants du site, ;;MSF France;L'équipe mobile de santé MSF France fait une consultation une fois pas semaine. ;Besoin d'augmenter la fréquence de soins;CM;World Vision/PAM;Décharge des vivres hier sur le site, les PDIs attendent la distribution;Attente de la disttribution;;Pas d'acteur;;;;BSF en NFIs;10 abris communautaire sont défectueux, les 68 ménages n'ont pas recu des NFI lors de la distribution faite par PU-AMI/BSF;Rehabilter les 10 abris communautaire sur le site; faire la distribution de NFI aux 68 ménages;430 kit NFI light;;Viste d'un reporting Officer de l'OIM ce jour 07/12/2015.;oui;/data/profils/BGI_S059.pdf
BGI_S067;St Sauveur;OIM(Facilitation du site);Maurice NGUENDA (Locale);77071338/72403104;60;18.12.;3314;3374;Stable;;Pas d'acteur;;;;Pas d'acteur ;Le contrat de FHAP a pris fin le 05/12/2015.;Besoin d'un acteur pour la relève.;;Pas d'acteur;;;;ACTED et ACF;Construction des 5 douches par ACF en cours;;Construction/maintenance/entretient latrines et douches, vidange latrines, collecte primaire et secondaire de dechets, accès à l'eau, activités d'hygiéne, drainage;Pas d'acteur;;Besoin d'inscrire les enfants du site à l'école.;;MSF Belgique;Consultation une fois par semaine.;;Santé primaire, dépistage et référence malnutrition, références médicales en cas d'urgence. CM tous âges Lundi et Jeudi + Vaccination rougeole 6 mois ;World vision/PAM; AFRICA-SERVICES;AFRICA-SERVICES a distribué des sacs de manioc le 08/12/2015.;;;Pas d'acteur;Besoin d'un acteur ;;;YAMACUIR/UNHCR;Innàdation des abris lors de la dernière pluie.;Besoin en abris pour 150 PDIs sans abri. Besoin de rehabilité trois abris troués;11 AC construits + 1 en cours de finalisation. Planification abris supplementaires en cours. Et 990 kit NFI light;;Enregistrement des PDIs par le HCR.;;/data/profils/BGI_S067.pdf
BGI_S068;Centre Jean 23;OIM(Facilitation du site);Magloire MALESSABA (Locale);77445146;164;18.12.;3826;3990;Diminution;RAS;ACF (mobile);L'equipe MPS de l'ACF est operatinnelle sur le site ce jour;;;FHAP;;;;ACF;;;;ACTED et ACF;Manque de collaboration entre le comité d'hygiène du site et l'équipe de l'ACF qui intervient sur ce site.;Besoin d'un bac à laissive.;Construction/maintenance/entretient latrines et douches, vidange latrines, collecte primaire et secondaire de dechets, accès à l'eau, activités d'hygiéne, drainage;Pas d'acteur;;Besoin: Scolarisation des enfants du site en âge scolaire;;MSF Belgique;;;Santé primaire, dépistage et référence malnutrition, références médicales en cas d'urgence. CM tous âges Lundi et Jeudi. Vaccination rougeole 6 mois - 10 ans ;World Visoin ;Le 12/12/2015 world-Vision a distribué des vivres mais plus de 200 menages ont manqué de vivre.;Besoin en vivre;;Pas d'acteur;;;;Yamacuir;Aumoins 200 PDIs sans abris et sont sous les veranda.;Besoin en abris pour 200 PDIs sans abri. ;;;Enregistrement des PDIs par le HCR.;;/data/profils/BGI_S068.pdf
BGI_S069;Eglise Four Square;OIM(Facilitation du site);YAMALE MAKELA (Locale);72043635;199;18.12.;805;1004;Stable;;ACF (mobile);ACF a une équipe mobile psychosociale sur le site chaque lundi;;;;ONG FHAP va cessé leurs activités sur l'ensemble des sites le 05 Décembre 2015. Il y a la présence de 6 enfants qui sont chefs de ménage. Un de ces enfants à 12 ans.;Besoins d'un acteur.;;Pas d'acteur;;;; ACTED,  ACF ;OXFAM va remplacé le conteur d'eau par un conteur propre a OXFAM. ACF a fournit cache nez, seau plastique, serpiaire savon et omo(une prévision de 25 décembre au 7 Janvier). L'eau est en permanance mais les latrines dégagent de mauvaises odeurs. Il y a eu présence des asticots;Besoin de grésil, besoin couvercle, station lavage de main, besoin de pioche et pelleBesoin des produits d'entretien des latrines. ;Construction/maintenance/entretient latrines et douches, vidange latrines, collecte primaire et secondaire de dechets, accès à l'eau, activités d'hygiéne, drainage;Pas d'acteur;7 ecoliers en provenance de l'ecole yakité et ngouciment sont sur le site, mais ne sont pas scolarisés.;Besoin de prise en charge de 7 écoliers. Besoin d'une structure éducative pour les  enfants qui sont sur le site car l'école Benz-vi est à moins d'un km du site.;;MSF Belgique, ;Les soins sont fait sur le site de sanctuaire.;Besoin à une équipe mobile de santé sur le site;Activités SMPS;CICR Africa-Service;CICR a fait un visite de prospection ce matin pour une évaluation afin d'une distribution de vivre;;;ACF;Un enfant malnuti est pris en charge par ACF;;;CRS et CARITAS;Distribution des sceaux de 10 et 15 litres à 35 menages sur la 169.;Certains menages n'ont pas reçu les seaux. Besoin des baches pour construire la véranda de l'église aux PDIs;199 kit NFI light distribués;On constate plus de femme chef de menage, besoin d'un appui en AGR pour une relance économique;;;/data/profils/BGI_S069.pdf
BGI_S079;Maison micheline;OIM(Facilitation du site);SCHELLA (Locale);75603056;70;18.12.;103;173;Stable (41 Menages), reprise d'enregistrement des PDIs par HCR ce jour;Patrouille de la force coventionnelle dans la zone;Pas d'acteur;World Vision CICR et autres sont plusieurs fois passé pour évaluation mais pas de réaction concrète.;Besoin d'acteur en WASH;;Aucun acteur;FHAP a céssé ses activités depuis le 05/12/2015.;Besoin d'un acteur;;Pas d'acteur;;Pas d'acteur;;ACF-OXFAM;Les latrines dégagent d'odeur nosiabonne. Il y a aussi beaucoup de mostiques.;Besoin de produit de désinfection; besoin d'insecticide pour lutter contre les moustiques.;Assanissement et Gestion de dechets;Pas d'acteur;Il y a 5 enfants qui ne sont pas scolarisés. ;Besoin de scolariser les enfants en âge scolaire.;;MSF Belgique ;2 jours par semaine de visite médicale sur le site de Sanctuaire.;;;Pas d'acteur;;Besoin urgent en vivre;;;;;;pas d'acteur;; ;;;Le site est un ancien centre de santé une zone très humide et innondable. Besoin d'attention de la part des acteurs en hygiène et assainissement..;;/data/profils/BGI_S079.pdf
BGI_S083;Eglise Evangelique Lutherienne;OIM ;SABAKERE John;72744655/75227817;75;16.12.;6;81;Stable;Patrouille permanente de la force conventionnelle dans la zone.;Pas d'acteur;;Besoin d'un acteur;;Pas d'acteur. ;;Besoin d'un acteur pour les ETAPE;;pas d'acteur;;;;OXFAM  + ACTED;OXFAM a distribuer les produits d'entretien et des reserves jusqu'au 7 janvier 2016;Besoin d'évacuation des tas ordures.;;pas d'acteur;;Besoin d'un acteur en éducation, car 22 enfants non scolarisé, besoin de scolariser ces enfants;;Pas d'acteur;;Besoin d'une équipe mobile de santé ;;Pas d'acteur;;Besoin en vivre;;Pas d'acteur;Plusieurs enfants présentent déjà les symptôme de malnutrition.;Besoin d'un acteur de nutrition.;;BSF;Deux abris communautaires est defectueux, 6 ménages n'ont pas recu les NFI lors de la dernière distribution faite par BSF;Réhabilité la toiture des 2 abris communautaire sur ce site;45 kit NFI light ;;;;/data/profils/BGI_S083.pdf
BGI_S102;Complexe Scolaire Adventiste;OIM(Facilitation du site);Goergette (Locale);75012406/75274503;122;18.12.;148;270;Stable;;Pas d'acteur;MINUSCA situé à proximité rassure les PDIs sur le plan sécuritaire.;Besoin d'un acteur;;Pas d'acteur;;Besoin d'un acteur pour les EAE;;Pas d'acteur;;;;OXFAM;;;Assainisement, Gestion de dechets;pas d'acteur;;;;Pas d'acteur;;Besoin d'une équipe mobile de santé;;;;Besoin en vivres; ;;Pas d'acteur;;;;;HCR fait un réamenagement des abris communautaires;Besoin de réhabiliter les abris ;78 kit NFI light;;;Distribution des NFIs aux PDIS de ce site;/data/profils/BGI_S102.pdf
BGI_S103;Complexe Pédagogique Béthanie;OIM(Facilitation du site);Maurice GOLEYENE (Locale);75502218;155;18.12.;404;559;Il y a une diminution des PDIs;Electricité disponible sur le site, mais pas de câble pour installation sur le site;ACF (mobile);;;;;;Besoin en protection de l'enfance;;Pas d'acteur;;;;ACTED  et ACF;Assistance en produit de désinfection des latrines et douches par ACTED 07/12/2015: quantité insuffisante;Besoin en évacuation des ordures;Construction/maintenance/entretient latrines et douches, vidange latrines, collecte primaire et secondaire de dechets, accès à l'eau, activités d'hygiéne, drainage;pas d'acteur;Manque de moyens financiers aux parents d'inscrire leurs enfants à l'école.;Scolarisation des enfants du site.;;MSF;;;;World Visoin ;;;;Pas d'acteur;;Besoin en acteur en nutrition ;;ACTED;;Réhabilitation des abris troués;;;;;/data/profils/BGI_S103.pdf
BGI_S104;Sanctuaire de Benz-vi;OIM(Facilitation du site);Serge KOWE (locale);75574314/ 72395863;697;18.12.;2050;2754;Stable;Un PDI (délégué de tente) a fait usage d'une arme blanche le 28 novembre 2015 vers 17heures suite à une mauvaise repartition des vivres des personnes qui sont sous sa tente.;ACF;pris en charge psychosociale. Reparation de portail par CICR;Besoin de remblais de l'entrée du site.;;Pas d'acteur;FHAP a céssé ses activités depuis le 05/12/2015.;Besoin d'un acteur, car les enfants du site sont a l'air libre et ya pas de suivi;;;;;;ACTED + ACF;ACF a fournit savon, omo, cache nez, gant, pioche. Les latrines du site sont vraiment sale, Les poubelles sont débordée;Besoin de mégaphone pour une sensibilisation sur le site. Besoin d'évacuation des ordures. ;Construction/maintenance/entretient latrines et douches, vidange latrines, collecte primaire et secondaire de dechets, accès à l'eau, activités d'hygiéne, drainage;Pas d'acteur;Il y a encore des enfants n'ont scolarisé sur le site;Besion d'une structure éducative pour l'année 2015-2016 aux enfants du site;;MSF Belgique, ACF;Fréquence de visite 2 jours par semaines (Mercredi et Samedi), ACF procède à l'ecoute des personnes traumatisée;;Santé primaire, dépistage et référence malnutrition, références médicales en cas d'urgence. CM Mercredi et Samedi + Vaccination rougeole 6 mois - 10 ans ;CICR, Société Saint Vincent de Paul;Dernière date de distribution le 28 novembre 2015.;;;ACF;ACF a déjà procédé au depistage;;;ACTED;17 abris restent à réhabiliter.;Besoin de réhabilitation des 17 abris;ACTED: AC construits + 1 construction en cours.                                  IDEAL:697 kit NFI light;JUPEDEC;L'enregistrement fait par HCR a pris fin ce jour 14/12/2015. Pour tout ce concerne l'effectif, veuillez contacter HCR.;Besoin d'argent pour louer une maison  et reprendre les AGR;/data/profils/BGI_S104.pdf
BGI_S110;Ndjongo;OIM(Facilitation du site);;;42;04.12.;5;47;Augmentation suite aux évènements de fatima du 26 Nov 2015;;Pas d'acteur;;;;;;;;Pas d'acteur;;;;ACTED;;;Collecte de dechets + Assanissement;;;;;RAS;;;;;RAS;;;;;;;RAS;;;;;;;/data/profils/BGI_S110.pdf
BGI_S111;Notre Dame Chartres;OIM(Facilitation du site);Sœur Charlotte (Locale);75404463;0;14.12.;0;0;Site vidé à cause de la dernière crise en la date du 26/09/2015;;;;;;tbc;;;;tbc;;;;;Reprise des activités de nettoyage du site;;;tbc;;;;Besoin d'une équipe mobile de santé;;;;World Vision/PAM;Distribution en vivre en date du 01 novembre 2015;;;tbc;;;;;Toutes ces PDIs sont dans des salles de classes;Besoin en NFIs (Moustiquaires, Nattes, hustencils de cuisines);;;Délocalisation des PDIs vers Notre Dame de Fatima et vers Bimbo suite à la crise du 26 Nov. 2015;;/data/profils/BGI_S111.pdf
BGI_S117;Ecole Koudoukou;OIM(Facilitation du site);AROUN COM (locale);72646477;0;18.12.;370;370;Stable ;;Aucun acteur ;;Besoin d'un acteur;;Aucun acteur;Présence de 63 enfants enregistré, ;Besoin d'un acteur pour les ETAPEs;;Pas d'acteur;;;;Pas d'acteur;OXFAM a distribuer les produits d'entretien et des reserves jusqu'au 7 janvier 2016;Besoin de collecter les ordures, besoin d'une fosse à ordure secondaire.Besoin en produits de l'entretien des latrines et besoin en eau potable;;Pas d'acteur;Des enfants en âge scolaires ne sont pas partis à l'école.;Besoin d'une structure éducative pour les enfants du site.;;Pas d'acteur;;;;Pas d'acteur;Les PDIs ont reçu des vivres depuis le 01/11/2015.;Besoin de vivres;;Pas d'acteur;;;;;;;;;;;/data/profils/BGI_S117.pdf
